id	date	branch@sha	term	before	after	unit	arbiter	status	note
GV	2026-09-30	r9700-ar-gv@ede2e0779 (no change kept)	verify n=5 GEMV sum (in-model 16k, perf logger)	40.84	40.84 (SG32+RM4 42.56, SG32+RM1 44.87, unroll 2/4 worse)	ms	n/a	discard	per shape in-model: gate/up 541 GB/s 85%, down 567 89%, 10240 563 88%, lm_head 618 96.6%. ISA: loads b64-b128, 96 VGPR, ALU ~14% of memory time -> gap is per-dispatch ramp/tail (~10-17 us/call), not width/occupancy/ALU. test-backend-ops perf is not a proxy (64 MB MALL replay -> 683 GB/s, ranks backwards). Remaining route is cross-dispatch overlap/fusion (~0.2-0.4 ms each); nontemporal needs a Vulkan memory model rewrite
FAC	2026-09-30	r9700-ar-fac@901abb2a8 (GGML_VK_PREALLOC_X_STEP_MIB, default 64; 0 = old)	server prefill 70k / 176k (depth.sh 1 rep ABAB, serving config)	base 1160.4,1161.1 / 680.4,680.9	step 1165.9,1159.6 / 705.5,706.5	t/s	FA 183/183; allocation-only change; accept 0.822/0.8136 same	candidate (+3.7% 176k prefill)	prealloc_x grows in 64 MiB steps instead of per ubatch. VRAM kill line not met: peak 32593, GTT oscillation remains. Cap GGML_VK_FA_DEQUANT_MAX_KV=65536 cut deep peak only ~320 MiB and made the deep image 1.8x slower (reject). Chunked FA (split-K partials in the RDNA4 prefill kernel) not attempted; prize uncertain since GTT oscillation survived the cap. NOTE 176k prefill is VRAM-state sensitive: HGR10 on-arm 803 vs 680 here on the same build
FACP	2026-09-30	r9700-integrate11 = r9700-ar-fac@901abb2a8 (integrate10 + 64 MiB prealloc_x step)	pooled 37, serving config	serve10 54.217 (load 5) / hgr10-on 55.688	55.775	t/s	37/37 texts = serve10	keep	bit-identical; promote candidate (+3.7% 176k prefill)
SERVE11	2026-09-30	r9700-qwen@901abb2a8 (= integrate11; old serving tagged r9700-qwen-integrate10)	promotion	-	-	-	same commit as the FACP-verified build (37/37 texts, pooled 55.775); serving binary rebuilt, not re-run	keep	promoted (operator approved 2026-09-30)
DF	2026-09-30	r9700-ar-df@9e45bdfb7 (GGML_VK_GEMV_MULTI=1, default off)	verify n=5 graph GPU (in-model ABAB, load <1.1)	43.165 (4 runs 43.154-43.178)	42.544 (3 runs 42.504-42.590)	ms	md5 identical 3 prompts incl 6196-tok; MUL_MAT + MUL_MAT_VEC_FUSION pass	discard (-0.62 ms < 1.0 kill line)	multi-matrix q6_K MMVQ merges gate+up (64), GDN qkv+z (47), attn q/k/v (32) dispatches of ~497 per verify; e2e 70k 63.48,63.59 -> 63.71,63.78 (+0.3%). Barriers are already dependency-based; remaining GEMVs are barrier-chained singletons, so no further same-input group exists. Per-dispatch overhead is now only reachable by a persistent/megakernel design
I8H	2026-10-01	r9700-ar-i8h@5e8d6f1 (perf-lab harness only)	exact Q6_K s8 GEMM weighted N=512 incl quant (harness/wmma_peak)	77.5	80.6	TOPS	PASS 8/8 vs CPU ref	discard (kill < 105)	issue-bound at 192 VGPR: RADV already interleaves each iu8 WMMA with its 8 mad24; software-pipelined epilogue no gain (82.1 vs 82.7); LDS reads not the limit (hoisting fragments leaves base 138); removing staging+barrier lifts sub24 94->118 (staging ~24%). Best 64x128 bk64 wg128 wave32. Register s8 peak 388 TOPS. Exact 8-bit Q6_K GEMM closed twice (P0, I8H). results/p0/i8h-20261001T062817Z.txt on r9700-ar-i8h
SPK	2026-10-01	r9700-qwen@901abb2a8 GGML_VK_Q6K_SPLITK=1/2/4/8	d0 ub512 in-model GEMM ms (perf logger)	default 311.2 total	SK1 320.1, SK2 319.4, SK4 335.3, SK8 369.8	ms	n/a	discard	default heuristic already picks the best factor per shape (down 64.8 default vs 65.3 SK2)
MPD	2026-10-01	r9700-qwen@901abb2a8 serving config	server prompt t/s, 32551-token prompt (mtp_prompt_ab.sh)	llama-bench pp32768 1423.9; server no-spec 1422.8,1402.3	server MTP 1313.6,1294.9	t/s	n/a	info	MTP prompt pass -7.7%; MTP GPU graph 11-14 ms/ubatch (~3%, perf logger), so ~17 ms/ubatch is host/idle -> MPH. Server itself free
FQ8	2026-10-01	r9700-ar-fq8@60604c797 (GGML_VK_FA_NO_Q8_STAGE=1 reverts; default ON on branch = regression, do not merge)	prefill FA+dequant ms/ubatch @65536 (prefill_profile ABAB)	166.3,167.0	189.9,191.0	ms	FA hsk=256 183/183	discard	live variant _v64; staging raw q8_0 into LDS re-dequantizes every K/V tile once per query block (32 per head at ub512) -> FA +35 ms vs -11.5 ms dequant pass. Needs a much larger query tile per WG to amortize; the separate pass already amortizes once per layer. No scratch on the q8 path (code reading)
FPQ	2026-10-01	r9700-ar-fpq@e1fb423cd (GGML_VK_FPQ_NS probe, default 1 = unchanged; GGML_VK_FA_PREFILL_DIAG probes)	prefill FA ms/ubatch @65536 (16 calls, prefill_profile ABAB)	153.8,155.4	NS=2 155.0,155.8; NS=4 157.1	ms	FA hsk=256 183/183	discard (not traffic-bound)	zero-traffic probe -8.1 ms only (caps WG-order/PQ32/Bc levers). No QK MMA -56, no PV MMA -62, neither -104 (50.3 left), no MMA+no loads 32.8: MMA path ~104 ms vs ideal ~72 at 184 TF and a ~50 ms VALU/softmax/barrier floor that does NOT overlap MMA. 240 VGPR, 6 subgroups/SIMD, LDS 54272, 2 WG/WGP; grid already head-adjacent. Lever: overlap softmax with MMA (producer/consumer split or more resident waves: <=192 VGPR, <=42 KB LDS) -> FOV
MPH	2026-10-01	r9700-ar-mph@7c46485d3 -> 93dd11a2f (KV-only draft prompt graph default ON, LLAMA_NO_MTP_KVONLY=1 reverts; deferred pass opt-in LLAMA_MTP_PIPE=1)	server prompt t/s 32.5k (mtp_prompt_ab) + depth.sh ABAB 3 reps + pooled 37	prompt 1310 (base1/base2 1320.5,1303.8,1306.4,1310.9); 70k prefill 1143,1164 / 176k 704,706; decode 62.74,62.80 / 60.53,60.48; pooled 55.697	both switches: prompt 1343.8,1341.6; 70k 1193,1193 / 176k 793,792; decode 64.05,64.02 / 60.94,60.97; pooled 55.365 (cand at load 2.2-3, FOV building). KV-only alone 1336.9,1330.8,1334.1,1332.5 vs both 1340.9,1339.1,1346.4,1333.9	t/s	pool texts 36/37 with pipe (corpus #14 diverges at char 2; stable in every prior pool run); KV-only alone 16/16 corpus identical; acceptance same; image ok; no lost-hidden-state errors	candidate -> integrate12 (KV-only only)	draft prompt pass was ~12 ms GPU + ~11 ms host idle per ubatch. KV-only skips Q/attn/wo/FFN/head when the draft batch has no outputs (K/V bit-identical). Pipe (+0.5%) defers the pass behind the next target ubatch but changes draft trajectories; root cause not found -> opt-in
I12	2026-10-01	r9700-integrate12@93dd11a2f (= integrate11 + MPH KV-only draft prompt graph; pipe opt-in)	depth.sh ABAB 3 reps + pooled 37 + image (autoresearch/ab_bin.sh, results/d0/e2e/ab-i12.log)	serving: 70k prefill 1159,1158 / 176k 706,706; decode 63.45,63.53 / 60.41,60.53; pooled 55.771	i12: 70k 1189,1189 / 176k 792,791; decode 63.77,63.75 / 60.54,60.89; pooled 55.956	t/s	pool texts 37/37 = serving and = serve10; accept identical (0.6978/0.7814, pooled 0.5116); image ok; target graph unchanged so gates4 (ops/PPL/KLD) not re-run	keep (promote candidate; not promoted, needs operator)	+2.6% 70k prefill, +12% 176k prefill, decode flat/+0.3%
FOV	2026-10-01	r9700-ar-fov@6b79cff3d (GGML_VK_NO_FOV=1 reverts)	prefill FA ms/ubatch @65536 (16 calls, prefill_profile ABAB same session)	off 158.16,157.93 (154-155 earlier)	on 150.12,150.24	ms	FA hsk=256 183/183	candidate -> integrate13 (gates + e2e pending)	ISA route: lazy O rescale TAU 8 (f32 kept), one 16-B sR read instead of two serial LDS round trips, loop-invariant prefetch offsets (+ volatile pin = null, droppable). Probes: no K-frag LDS -8.7, no V-frag -12, no rescale -5.8: not LDS-bound; VALU and WMMA share issue on RDNA4 so overlap cannot hide ~22 ms real VALU; 3 WG/WGP adds a 1.33-round tail; 1-barrier double buffer needs ~91 KB LDS. Left: ~30 VALU/tile of rematerialized staging math, v_dual_mov from loop-carried prefetch regs, log2e mul before exp. d0 FA 1.71 vs 1.75
MFL	2026-10-01	r9700-ar-mfl@72b286747 (LLAMA_NO_MFL=1 reverts; on integrate12)	server prompt t/s 32.5k (mtp_prompt_ab ABAB)	off 1343.0,1326.2,1361.2,1333.8 (mean 1341)	on 1378.8,1349.3,1357.4,1344.0 (mean 1357)	t/s	md5 + draft/accept 255/135 identical	discard (parked: +1.2% < +2 kill line, noise +-15)	contiguous ubatch views batch embd instead of copying (llama-batch.cpp ubatch_add, 8.2 ms/2048) + process() keeps only last hidden row for >64-row batches (10.5 ms/2048). Floor: target ubatch +7 ms with MTP because last layer runs for every row (drafter needs all hidden states) -> not removable without changing drafts. Ceiling with draft prompt pass ~1360-1370; 1390 unreachable this way
FV2	2026-10-01	r9700-ar-fv2@35879ebf9 (GGML_VK_NO_FV2=1 reverts to FOV)	prefill FA ms/ubatch @65536 (16 calls, prefill_profile ABAB)	FOV 155.75,154.70	140.53,140.50	ms	FA hsk=256 183/183	candidate -> integrate13 @fdebb22f5 (FOV+FV2)	loop VALU 164 -> 130 per tile: log2e folded into QK scale and staged mask (f16 mul at staging; Qwen mask is 0/-inf so exact), exp2, TAU 8*log2e, LDS staging bases hoisted, mask predicates hoisted. Left: ~40 VALU of RA shuffles near 256 VGPR, prefetch add_lshl ~8
GQV	2026-10-01	r9700-ar-gqv@885af2e9b (GGML_VK_NO_GQV=1 reverts; 6 LEANQ variants via _g2 modules)	Q6_K GEMM ms/ubatch d0 ub512 (sum q6_K MUL_MAT + SWIGLU, prefill_profile ABAB)	245.22,245.62	238.36,238.85	ms	MUL_MAT 1157/1157, MUL_MAT_VEC_FUSION 1271/1271	candidate (-6.8 ms, just over 6 kill line) -> integrate14	K-loop VALU 380->339 per 4 K steps: Q6_K 2-byte misalignment funnel shift done once per loaded array. Rejected: LDS fragment hoist, K-permuted pairing (+4.5), double-buffered LDS (+28), DB+dequant between kk groups (+20). Ablation: skipping the dequant+LDS-store phase = 183.6 (-62 ms): dequant runs between barriers with no WMMA in the wave and is not VALU-issue bound -> overlap structure (GQ2)
GATES13	2026-10-01	r9700-integrate13@fdebb22f5 (integrate12 + FOV + FV2)	gates4.sh (GATES_CLI=-lm none; KLD without HGR env)	GATES10: PPL 2.2878; KLD 70k b4/b1 0.000753/0.000682, 176k 0.000235/0.000185; acc corpus 0.7007 chat 0.5339	PPL 2.2877; KLD 0.000741/0.000588, 0.000278/0.000199 (flips 2,2,0,1 of 512); acc corpus 0.7111 chat 0.5339; FA 183/183 + 21 op suites pass	-	all pass	keep (gates)	results/d0/gates-integrate13-20261001.txt; e2e A/B vs integrate12 pending (first attempt hit the 2 h job limit after the gates)
FV3	2026-10-01	r9700-ar-fv3@8b90fadc5 (GGML_VK_NO_FV3=1 reverts to FV2)	prefill FA ms/ubatch @65536 (16 calls, worker ABAB)	off 149.89,151.42	on 142.11,142.34	ms	FA hsk=256 183/183	pending root check (off arm 150 vs FV2 140.5 earlier: drift or real?)	prefetch addressing via one base + immediate offsets, mask as one half2 word + v_pk_mul_f16, no has_mask selects; host guard: v64 needs mask offset/nb1/nb3 %4. Loop VALU G=6 149->142, G=4 168->139; RA shuffles not removed (239 VGPR). Unroll x2 null
I13	2026-10-01	r9700-integrate13@fdebb22f5 (integrate12 + FOV + FV2) vs integrate12	depth.sh ABAB 3 reps + pooled 37 + image (results/d0/e2e/ab-i13.log)	i12: 70k prefill 1189,1189 / 176k 792,792; decode 63.90,63.81 / 60.71,60.83 (accept 0.6978/0.7814); pooled 55.941 (ms_step 53.71)	i13: 70k 1218,1220 / 176k 844,844; decode 62.06,61.95 / 59.00,59.16 (accept 0.6703/0.7610); pooled 55.731 (ms_step 53.68, accept 0.5086)	t/s	GATES13 pass; texts 28/37 (FA numerics change); image ok	keep	prefill +2.5% 70k, +6.6% 176k (176k target >=800 met). depth.sh decode -2.8% is acceptance on its one degenerate prompt (ms/step unchanged); pooled -0.4% within the -1% rule; gate corpus acceptance up 0.7007->0.7111
GQ2	2026-10-01	r9700-ar-gq2@06eb53f71 (opt-in GGML_VK_GQ2=1|2; GGML_VK_Q6K_DIAG ablations committed)	Q6_K GEMM ms/ubatch d0 (prefill_profile ABAB)	GQV 246.55,244.23	GQ2=2 (B frags global->regs, 9 KB LDS, 120 VGPR, 6 WG/CU) 250.46,249.97; GQ2=1 (+B prefetch, 192 VGPR) 266.18,266.42	ms	MUL_MAT 1157/1157, FUSION 1271/1271	discard (kill)	harness probe: WMMA alone 5.51 ms, VALU alone 5.64, both in one wave 11.49 -> VALU and WMMA share issue on RDNA4; dequant is issue cost, cannot be hidden by occupancy/producer-consumer/prefetch. DIAG: no deq4p 191.1, no dequant+store 169.2, no WMMA 50.0 (base ~244). Only lever: fewer dequant VALU per WMMA (pk_fma instead of pk_add+pk_mul ~5 ms, not bit-identical)
FV3c	2026-10-01	root check: integrate13 (FOV+FV2) vs r9700-ar-fv3@8b90fadc5 build	prefill FA ms/ubatch @65536 (prefill_profile, alternating)	i13 140.03,140.16	fv3 142.05	ms	-	discard FV3	FV3 worker off-arm (NO_FV3) read 150-151 vs FV2 140.5 -> its -8.4 ms was against a slower revert path; vs the real FV2 kernel it is +2 ms
I14	2026-10-01	r9700-integrate14@94ac23294 (integrate13 + GQV) vs integrate13	llama-bench pp2048 d0 / d16384 r2 ABAB + pooled 37	i13 1628.24,1590.58(noisy +-5.4) / 1430.74,1410.06	i14 1623.04,1616.34 / 1431.81,1431.64; pooled 55.716 (ms_step 53.70)	t/s	MUL_MAT 1157/1157, FUSION 1271/1271; texts 37/37 = i13	discard (no e2e gain beyond noise)	GQV -6.8 ms/ubatch in the perf logger does not show end to end; integration head stays integrate13
