id	date	branch@sha	term	before	after	unit	arbiter	status	note
D0b	2026-09-28	flags	draft FA per step @176k	4.9	2.7	ms	pooled acc 0.7058->0.7075	keep	-ctkd q8_0 -ctvd q8_0; -234 MiB
D1	2026-09-28	r9700-d1-draftvocab@290ad95c0	draft lm_head	1.651	0.43	ms/draft	chat acc 0.5386->0.4111	discard	static subset collapses multilingual; opt-in only
D1b	2026-09-28	r9700-d1b-adaptvocab@cf313ca85	draft lm_head (subset steps)	1.67	0.68	ms/draft	corpus 0.7041 chat 0.5368	keep	98k adaptive; held-out multilingual pending
D2	2026-09-28	r9700-d2-hostchain@5a5725c34	decode t/s	46.5	44.8	t/s	chat set	discard	full head dominates; chain saves <=0.6 ms
D3	2026-09-28	r9700-d3-verifyhost@659a4bd7a	host prompt copy	0.12	0.06	ms/step	byte-identical	keep	small fix only; depth growth was CPU contention
D4	2026-09-28	r9700-d4-smallops@1a8ef3e75	verify small ops	7.58	3.40	ms logged	gates	keep
D5	2026-09-28	flags	n_max 4 pooled t/s	+1.4%/-1.1%	-	70k/176k	pooled acc 0.6285	discard	wash pooled; +5% depth.sh only
D6	2026-09-28	r9700-d6-mtpmerge@4dd599b91	draft host+wait	4.78	4.05	ms/step	chat t/s 45.35->44.63	discard	under -1.5 kill line
P0	2026-09-28	perf-lab@184db02	weighted s8 GEMM	-	77.5	TOPS	gate 135	discard	per-16 int epilogue costs as much as WMMA
P1	2026-09-28	r9700-p1-f16sb@f9968c35f	pp2048 d0	1521	1577	t/s	llama-bench	keep	lean dequant + 4x K unroll; 12288x5120 -7%
P1b	2026-09-28	r9700-p1b-q6stage@740b186da	GEMM	-	-19%	rel	microbench	discard	occupancy
P2	2026-09-28	r9700-p2-prefa2@7cf24fe12	prefill FA	77.3	83.6	TF	microbench	keep	pre-transposed V + 64B rows
P2b	2026-09-28	r9700-p2b-prefa3@a3985c827	prefill FA	84.8	79	TF	microbench	discard	K-direct coopMatLoad
E2E4	2026-09-28	r9700-integrate4@093e47d59	depth.sh decode 70k/176k	49.5/46.8 (am quiet)	53.0,53.6/49.3,44.0	t/s	depth.sh (loaded: ollama+swap, load 4-6)	keep	integrate2 same-run 46.1/38.6 contaminated; bench pp2048 d0 1463+-91 d16384 1312 pp512 d131k 751 (integ2 same run 1237/1321/651); rerun quiet
D1b-HO	2026-09-28	r9700-integrate4@093e47d59	held-out multilingual acc (8 prompts)	0.5178 (vocab 0)	0.5178	acc	heldout_acc.py	keep	texts identical; D1b passes held-out
W1	2026-09-28	r9700-ar-w1-draftwin@c5956c845	draft FA per step @60k	1.12	0.375 (W=8192)	ms	tok/step 3.268 -> 2.866 (-12.3%) long-copy prompts	discard	MTP layer uses long-range context; W=32768 still -6.7%
POL	2026-09-28	r9700-integrate4@093e47d59 flags	pooled t/s (37 prompts, short ctx)	47.28 (n3 p0)	n4p0 48.32; any p_min 39.7-46.2	t/s	pool.py tok/step n3 2.75 n4 3.01; load 3-23	n4 candidate; p_min discard	p_min cuts tok/step far more than it saves (verify cost ~flat in rows); n4: corpus +7% chat -0.8% heldout +0.3%
B4	2026-09-28	r9700-integrate4@093e47d59	verify GPU n=4/n=5 @176k	56.87	58.12	ms	perf logger	keep	n=5 now only +1.25 ms (was +3.5); draft n=1 2.1 ms, catch-up 1.7; q6_K GEMV n=4 528 GB/s vs n=1 617 -> W2 target; f32 m=48 GEMV 0.92 ms at 100 GB/s
POL5	2026-09-28	r9700-integrate4@093e47d59 flags	pooled t/s n_max 5	48.32 (n4)	46.96	t/s	pool.py tok/step 3.14 (n4 3.01, n3 2.75)	discard	chat/heldout lose; n_max 4 stays the candidate
W2	2026-09-28	r9700-ar-w2-gemv@7141fa709	verify GEMV n=4 (synthetic, MALL-resident)	109.7us	109.7us	us	MUL_MAT 1147/1147, FUSION 1271/1271	discard (n=4); MMVQ n>=5 candidate	dequant-reuse reorder no change (ACO CSE); MMVQ at n=5 87 vs dmmv 129 us synthetic; switch GGML_VK_Q6K_MMVQ_MIN_N
P3	2026-09-28	r9700-ar-p3-prefops@7d15a3613	pp512 d131072	685.2	769.9	t/s	FA 104/104, PPL 2.2879 exact	candidate	per-device pinned host buft (was device 0 -> staging path), mask_opt cache across FA layers, threaded KQ mask fill; pp2048 d0 1588->1576 (noise?)
P2c	2026-09-28	r9700-ar-p2c-prefa@43ac604d0	prefill FA TF isolated	84.16	not measured	TF	untested (GPU lock starved by root gates)	pending	LDS 53.3/64 KB: double-buffered V/K needs BC halving; built mask-only double buffer GGML_VK_FA_PREFILL_RDNA4_DB=1, expected ~0
G1	2026-09-28	r9700-ar-g1-gemvdisp@250e5c3cb	verify GEMV n=4 in-model sum	42.204	42.258	ms	MUL_MAT 1147, FUSION 1271	discard	q8_0 rows/WG 4 at n=4 regressed +2.4%; gate+up fusion and f32 m=48 split-K not attempted
GATES5	2026-09-29	r9700-integrate5@c36820bec	gates4.sh	-	all pass	-	21/21, FA 183, PPL 2.2879, KLD 4/4, acc 0.7041/0.5332	keep	ready for quiet e2e + n_max 4
RM	2026-09-29	r9700-integrate5@c36820bec	verify graph n=4 (in-model, 16k ctx)	42.911 (rm=4 default)	rm1 63.58 / rm2 46.86 / rm8 49.37	ms	perf logger, load ~30 (GPU times)	discard	q6_K rows/WG 4 stays; GEMV sum 39.1 vs 59.3/42.9/45.1
UB	2026-09-29	r9700-integrate5@c36820bec	pp2048 d0 / d16384 by ubatch	1582.4 / 1389.3 (ub512)	ub1024 1563.2/1391.7; ub2048 1527.6/1367.4	t/s	llama-bench r3, load 8-27	discard	ubatch 512 stays; bigger ubatch loses d0, flat at 16k
P2c	2026-09-29	r9700-ar-p2c-prefa@43ac604d0	prefill FA TF isolated (kv 131584 nb512)	80.89/80.78 (DB=0)	80.81/80.92 (DB=1)	TF	test-backend-ops perf ABAB	discard	mask-only double buffer ~0 as expected; LDS full blocks the V/K version
G2B	2026-09-29	r9700-ar-g2-gateup (no change)	verify f32 m=48 GEMV	0.424 (16k) / 0.92 (176k)	not built	ms	-	discard	ceiling under 1 ms/step kill line; already 256-thread WG on RDNA4 (GGML_VK_NO_DMMV_F32_WIDE); split-K reduction cost ~= gain
G2A	2026-09-29	r9700-ar-g2-gateup@9a40c1ecc	verify fused gate+up+GLU region (in-model n=4, ABAB)	17.23/17.53 (GGML_VK_NO_GATEUP_FUSE=1)	17.11/16.84	ms	MUL_MAT_VEC_FUSION 1271/1271	discard	mean -0.41 ms < 0.8 kill line; graph 43.11->43.35, 43.92->42.45 (noise ~1 ms); branch kept unmerged
MV4	2026-09-29	r9700-integrate5@c36820bec	verify graph n=4 in-model (ABAB), GGML_VK_Q6K_MMVQ_MIN_N=4	42.924/42.946	43.527/43.779	ms	perf logger, load 2-4	discard	MMVQ at n=4 +0.6-0.8 ms; n>=5 threshold stays. Base pairs agree to 0.02 ms at load ~3 (G2A spread was load 10-15)
E2E5	2026-09-29	r9700-integrate5@c36820bec	depth.sh decode 70k/176k (quiet, load<1)	i4 n3 52.05/47.58; i5 n3 52.07/47.54	i5 n4 55.98,55.97/55.72,55.71	t/s	depth.sh 3 reps, spreads <0.35%	keep	176k target (>=55) MET at n4; 70k 56.0 < 60 not met; P3 decode-neutral
N4	2026-09-29	r9700-integrate5@c36820bec flags	pooled t/s 37 prompts n3 vs n4 (quiet)	48.509 (tok/step 2.748)	49.689 (tok/step 2.971)	t/s	pool.py load<2.6	keep	+2.4% pooled; corpus +8.0% chat +0.8% heldout -2.6%
Q8G	2026-09-29	r9700-ar-q8g-gemm@1a6e52468	q8_0 GEMM m5120 n512 k6144	59.7 TF in-model (539 us), 64.6 isolated	83.9 TF in-model (384 us), 83.0 isolated	TF	MUL_MAT full pass on/off	candidate	new mul_mm_q8_rdna4_f16.comp (P1 skeleton for q8_0); GGML_VK_NO_Q8_GEMM_TUNE=1; ~-7.5 ms/ubatch (~2.4%); reads <=4 B past last block (unused, page-granular alloc)
GDN	2026-09-29	r9700-ar-gdn-prefill@ae8b2e4d9 (tests only)	GATED_DELTA_NET prefill ub512 (in-model)	14.74 (307 us x48)	14.99 (prefetch variant)	ms	GDN/_CACHE_FUSION/GDN_RECURRENT_CACHE pass (new n>=64 cases)	discard	fp32 VALU-bound at ~65% of floor (~200 us); prefetch no gain; only chunked WY/WMMA form could reach 2x (multi-day, numerics risk)
GATES6	2026-09-29	r9700-integrate6@1a6e52468	gates4.sh	-	all pass	-	21/21 suites, FA 183, PPL 2.2878, KLD 70k b4 0.00075, acc 0.7007/0.5368	keep	ready to serve
E2E6	2026-09-29	r9700-integrate6@1a6e52468	pp2048 d0 / d16384 / pp512 d131072 (ABAB)	i5 1576.3,1577.1 / 1375.9,1378.2 / 768.0,764.5	i6 1606.8,1607.0 / 1403.3,1403.1 / 770.7,774.3	t/s	llama-bench r3/r2, load <1.2	keep	Q8G +1.9% d0 and d16384; 131k within noise; decode path untouched (GEMM n>=64 only)
MQ5	2026-09-29	r9700-ar-mq5-mmvq@df1e6be71	verify n=5 graph (in-model ABAB, load ~1.5)	45.95/46.03 (GGML_VK_NO_MQ5_TUNE=1)	44.65/44.60	ms	MUL_MAT 1157, FUSION 1271, MUL_MAT_ID 937	candidate	q6_K MMVQ fast path (dmmv-style 16 thr/superblock) + 2 rows/WG at n>=5; GEMVs ~520 GB/s size-independent, ~8 us/call fixed cost (quantize+barrier)
PSO	2026-09-29	r9700-ar-pso-prefill@1e1a48cb0	prefill ub512 d0 (in-model): residual ADD in GEMM epilogue	ADD 5.73 ms, total 313.9/314.7	ADD 1.69 ms, total 313.0/313.1	ms	MUL_MAT 1157, ADD 101, CONCAT 201, MUL_MAT_ADD_GEMM 28; PPL 2.2878	discard	net -1.3 ms (< 4 kill): fused GEMMs +2 ms; 32 linear_attn_out adds unfused (SCALE between); GDN conv CONCAT already at ~1 TB/s floor. Branch parked
QFC	2026-09-29	r9700-ar-qfc-fixedcost (no commits)	verify n=5 graph: q8_1 quantize fixed cost	44.60/44.74	43.63/43.62 (quantize skipped = upper bound)	ms	-	discard	ceiling ~1.0 ms, real fusion ~0.6-0.8: quantize reuse and barrier grouping already present; remaining ~8 us/call is in-kernel ramp/tail and RAW barriers
E2E7	2026-09-29	r9700-integrate7@df1e6be71 n4	depth.sh 70k/176k + pooled t/s (quiet, load<1.9)	i6 n4 58.40/55.74; pooled 50.248	i7 n4 59.41,59.33/57.27,57.26; pooled 50.738	t/s	depth.sh 3 reps + pool.py; gates4 all pass (acc 0.7007/0.5339)	keep	MQ5 +1.7% 70k, +2.7% 176k, +1.0% pooled; 70k target 60 missed by 1%; gates do not exercise n=5 (KLD b1/b4, acc at n3)
RB7	2026-09-29	r9700-integrate7@df1e6be71 n4	re-baseline at DDR4-3200 (was 3600): depth.sh 70k/176k + pooled	i7 n4 @3600: 59.41,59.33 / 57.27,57.26; pooled 50.738	i7 n4 @3200: 59.39,59.16 / 57.18,57.13; pooled 50.845	t/s	depth.sh 3 reps (load<1, spreads <0.25%) + pool.py (load<1.7)	keep	RAM speed no measurable effect (-0.2% depth, +0.2% pooled); new reference. First 2 depth runs discarded (load 12-22 mid-run)
RSV	2026-09-29	r9700-ar-rsv@a3f090459	verify graph GPU (16k, n=5, in-model ABAB): identity state gather -> view	44.80/44.86 (LLAMA_NO_RS_VIEW=1)	45.66/45.64	ms	no ggml change; greedy md5 not run (killed first)	discard	gather is identity on only ~15-18% of verify steps (MTP rollback reads snapshot row idx*size+src0); flag flips break can_reuse (rebuilds) and shift GDN_CACHE fusion; +0.8 ms. Branch kept, not merged
R7P	2026-09-29	r9700-ar-r7p@10473ec6e (on R7 base 2fc6d40aa)	draft phase host ms (16k, n_max 3, LLAMA_DECODE_TIMING)	a loop 3.2 (2.5 noisy run); b chain 9.35	d loop+host GET_ROWS 1.04; c chain+host GET_ROWS 1.2	ms	GET_ROWS op test pass; greedy md5 identical a/b/c/d	candidate	GPU chain adds nothing; the win is Vulkan GET_ROWS reading token_embd from pinned host (needs -lm none: 995 MiB Vulkan_Host, 0 VRAM). Chain 1 split vs 6. Ported vulkan-only as HGR
RSI	2026-09-29	r9700-ar-rsi@0381f8f51	verify graph GPU (16k, n=5, in-model ABAB): GDN_CONV_STATE fusion cap 4 -> 8 snapshot CPYs	46.112/44.804 (LLAMA_NO_RS_INDEX=1)	44.189/44.201	ms	GDN_RECURRENT_CACHE 13/13, GDN_CACHE_FUSION 5/5, GATED_DELTA_NET 37/37, GET_ROWS 240/240 (K=5,8 cases added); greedy md5 identical 3 prompts + repeat	candidate	ssm gather was already fused; per-op: CPY x240 -0.58, GET_ROWS x50->x2 -0.18 => ~-0.76 ms real (pair2 -0.60; pair1 off run noisy). Below 1 ms per pair; e2e after HGR. Push-const arrays need constant indices on RADV
HGR	2026-09-29	r9700-ar-hgr@dddb7deb5 (-lm none both arms)	depth.sh ABAB + pooled 37, GGML_VK_HOST_GET_ROWS off vs on	off 59.19,58.91 / 55.98,56.77; pooled 51.107 (texts = i7 reference)	on 80.7,80.5 / 70.8,70.9 (accept 1.0 = degenerate); pooled 53.087	t/s	texts: 16/16 corpus DIFFER, 21/21 chat+heldout identical	discard (bug)	corrupts long raw prompts (prefill path); on identical-output sets chat 46.94->49.50, heldout 43.79->46.57 (ms/step -3.0): worth fixing -> HGRfix worker
GR2	2026-09-29	r9700-ar-gr2@24fb20bca	verify graph GPU (16k, n=5, in-model ABAB): ne00==1 f32 GET_ROWS fast path (reduced-vocab logits unpermute)	45.837/44.784 (GGML_VK_NO_GR_SMALL=1)	43.668/43.699	ms	GET_ROWS 243/243 (ne00=1 + zero-stride unperm cases added); greedy md5 identical 3 prompts incl 6458-tok raw	candidate	GET_ROWS 1.272/1.277 -> 0.197/0.197 ms per graph (deterministic -1.08); generic get_rows ran 1 active lane per 512-thread WG
HGRfix	2026-09-29	r9700-ar-hgr@c4e20f425	long-prompt correctness, GGML_VK_HOST_GET_ROWS=1	ON drifted past ~1024 tok (3rd ubatch on); corpus 16/16 differ	ON bit-identical to OFF (logprobs @1030/1500; md5 corpus 0,5,9 + 27k raw)	-	GET_ROWS 241/241 both env states (Q6_K 5120x248320 512-row case added)	candidate	root cause: llama_decode does not sync before set_inputs, next ubatch token ids overwrote those a queued GPU GET_ROWS had not read yet; env-gated sync in llama-context.cpp. Also fixed misalign offset base for pinned tensors. e2e in integrate9
E2E8	2026-09-29	r9700-integrate8@0b5e351c8 n4 (i7 + RSI + GR2)	depth.sh 70k/176k ABAB + pooled 37	i7 58.90,58.23 / 56.87,56.88; pooled 50.547	i8 60.42,59.37 / 57.59,57.06; pooled 51.756	t/s	depth.sh 3 reps + pool.py (load<2); 37/37 texts identical to i7	keep	+2.2% 70k (60 target met on 1 of 2), +0.8% 176k, +2.4% pooled
GATES8	2026-09-29	r9700-integrate8@0b5e351c8	gates4.sh	-	all pass	-	21/21 suites, FA 183, PPL 2.2878, KLD = i7 (70k b4 0.000753), acc 0.7007/0.5339 = i7	keep	ready to serve
E2E9	2026-09-29	r9700-integrate9@d4c399bb4 (i8 + HGR+fix), -lm none both arms	depth.sh ABAB + pooled 37, GGML_VK_HOST_GET_ROWS off vs on	off 60.23,60.44 / 53.19(noisy 16.9%),58.07; pooled 52.379 (texts = i8)	on 62.65,63.06 / 60.14,60.11; pooled 55.359	t/s	37/37 texts identical on vs off; accept identical (0.6978/0.7814)	candidate (prefill regression)	decode +4.2% 70k, +3.5% 176k, +5.7% pooled; BUT depth.sh prefill -14% (70k 1005/982 -> 864/838, 176k 525/550 -> 465/477): sync-before-set_inputs and/or 512-row PCIe gather. Fix = small-batch-only -> HGR2
PF8	2026-09-30	r9700-integrate8@0b5e351c8	pp2048 d0 / d16384 (llama-bench r3, ABAB)	i7 1604.0 (1400 run noisy +-82) / 1393.1,1398.3	i8 1591.7,1600.2 / 1406.2 (1363.8 run noisy +-17)	t/s	-	keep	prefill neutral within ~0.5%; noisy runs overlapped HGR2 worker activity
HGR2	2026-09-30	r9700-ar-hgr2@faa032b3c (WIP)	gate host GET_ROWS/in-place inputs to n_tokens<=16	OFF pp2048 1610; server c0-c2 65.9/58.6/57.3	ON-after pp 1605; decode 28-32 (draft accept 0.17)	t/s	md5 = OFF incl 29k prompt; GET_ROWS test not run	discard	prefill loss not reproduced <=32k (ON-before 1618 vs 1610, d32k 1263 vs 1257). Decode gain is NOT the embd gather: it is GPU reading host inputs (mask/pos) in place + no split; with inputs copied, decode = OFF. Gated build breaks MTP accept when reserve has large batch (cause unknown)
PFS	2026-09-30	r9700-integrate9@d4c399bb4, -lm none	server prefill 72k (depth.sh 1 rep): MTP vs none x HGR off/on	mtp-off 1008,1007; none-off 1249	mtp-on 897,898; none-on 1244	t/s	-	info	HGR prefill loss (-11%) is only in the MTP draft pass over the prompt; target prefill unaffected (llama-bench d70k +1%). MTP prompt pass itself costs -19% prefill at 70k (1249 -> 1008) -> MTPP
HGR3	2026-09-30	r9700-ar-hgr3@b9113d461 (diagnostics)	MTP prefill 72k / decode 70k (depth.sh 1 rep, NPRED 16)	OFF 1008/71.7; ON-before 897/74.5	ON-after 906/73.4 (copy large host inputs: no effect)	t/s	not run (no fix)	discard	not PCIe in-place reads, not the sync. Worker inference: VRAM at limit at ctx 262144 (idle 33.73 GB off / 33.98 on of 34.2), FA_DEQUANT_KV 0.77 -> 11.5 ms at 72k => scratch spills; -c 240000: OFF 1085, ON 1123 (+3.5%). OFF at 262k already below 240k -> VRAMCTX check
VCTX	2026-09-30	r9700-integrate8@0b5e351c8 serving flags	depth.sh 1 rep x2, ctx 262144 vs 240000 (+ vram/gtt sampling)	262144: prefill 983,1006 / 550,549; decode 66.2,67.0 / 57.3,56.7	240000: prefill 1064,1081 / 612,571; decode 66.1,67.6 / 57.6,57.5	t/s	peak VRAM 32600-32605 of 32624 MiB both; GTT 3.0-3.7 GB both (no clean diff)	info	same work at same depth, so ctx 262k costs ~7-8% prefill at 70k (memory placement, likely driver eviction to GTT); decode unaffected. Serving config loses prefill today. mmproj-F16 = 885 MiB on GPU -> VB
SERVE8	2026-09-30	r9700-qwen@0b5e351c8 (= integrate8; old serving tagged r9700-qwen-integrate7)	promotion: pooled 37 on serving build	-	pooled 52.614; 37/37 texts = integrate8	t/s	greedy texts byte-identical to integrate8 pool	keep	promoted (operator approved 2026-09-30)
CRASH	2026-09-30	-	03:07-03:10 system OOM	-	-	-	-	info	perf-lab-nightly.timer (03:07:28) started llama-bench canaries 2 s after a VB server run (03:07:26) took the GPU lock; bench.sh VRAM-used guard passed because the server was still loading. Two 22 GB models on 32 GB VRAM -> driver put overflow in system RAM (non-swappable), RAM+swap full, OOM killed desktop, claude, muninn. nightly/drain/heartbeat timers disabled, nightly+drain services masked (operator: never run again)
VB	2026-09-30	r9700-ar-vb@1284c801e (i8 + lazy mmproj, MTMD_LAZY_GPU=1)	server prefill 70k/176k @ctx 262144 (depth.sh 1 rep, ABAB)	base 1008/549, 1008/541	lazy 1119/665, 1114/659	t/s	decode 66-67/57-58 both; accept 0.822/0.8136 both; image requests work (4140-tok prompt wall 12.9/11.6 s -> 15.5/13.2 s)	candidate	VRAM MiB: weights 20819, KV 8704, RS 748, target compute 388, draft KV 544, draft compute 328, mmproj 885+248 = 32664 of 32624 -> oversubscribed; lazy mmproj frees ~1130 while idle. +10.8% 70k, +21% 176k prefill; costs ~2 s per image request. In integrate10
MTPP	2026-09-30	r9700-ar-mtpp@2c94fae58 (on ar-vb, MTMD_LAZY_GPU=1)	server prefill 70k (depth.sh 1 rep)	MTP 1120 (none 1247: gap now -9.7%, was -19% while oversubscribed)	MTP_PROMPT_FAST=1 1124	t/s	accept 0.822 both; decode 67.4/67.0; md5 not run (missed kill line)	discard	MTP prompt pass = 127 ms per 2048-tok decode (graph 104, set_inputs 15 = 42 MB embd upload), proportional to 1 layer; draft batch already has no logits. Only lever left is overlapping MTP with the target on a second queue, capped ~3%. Half of the old 19% was VRAM pressure, fixed by VB
HGR10	2026-09-30	r9700-integrate10@ede2e0779 (i9 = i8 + HGR+fix, + VB), -lm none, MTMD_LAZY_GPU=1 both arms	depth.sh ABAB 3 reps + pooled 37, GGML_VK_HOST_GET_ROWS off vs on	off decode 60.32,60.76 / 57.91,58.48; prefill 1119,1121 / 709,716; pooled 52.873	on decode 63.51,63.49 / 60.51,60.57; prefill 1160,1161 / 803,802; pooled 55.688	t/s	37/37 texts on = off = serve8 (integrate8); accept identical (0.6978/0.7814, pooled 0.5116)	candidate	decode +4.8% 70k, +3.9% 176k, +5.3% pooled; prefill now +3.6% 70k, +12% 176k (the E2E9 -14% was VRAM pressure, gone with VB). vs SERVE8 pooled 52.614: +5.8%. Needs gates4 before serving
GATES10	2026-09-30	r9700-integrate10@ede2e0779, -lm none + GGML_VK_HOST_GET_ROWS=1 + MTMD_LAZY_GPU=1	gates4.sh (GATES_CLI=-lm none)	-	all pass	-	21/21 suites, FA 183, PPL 2.2878, KLD 4/4 = i8 (70k b4 0.000753), acc 0.7007/0.5339 = i8	keep	TRAP: GGML_VK_HOST_GET_ROWS=1 WITHOUT -lm none (token_embd on device) corrupts decode (KLD 70k b4 0.27-0.32, 176k 0.94); llama-decode-kld accepts -lm none. Serving must set both or neither
SERVE10	2026-09-30	r9700-qwen@ede2e0779 (= integrate10; old serving tagged r9700-qwen-integrate8)	promotion: pooled 37 on serving build, -lm none + MTMD_LAZY_GPU=1 + GGML_VK_HOST_GET_ROWS=1	-	pooled 54.217 (load ~5: sibling go tests; quiet A/B 55.688)	t/s	37/37 texts = hgr10-on = serve8	keep	promoted (operator confirmed 2026-09-30 "continue, keep working")
TREE0	2026-09-30	r9700-ar-tree0@82b2835ee (serving config + MTP_TOP2_LOG=1)	oracle: MTP top-k rank of target token when draft pos 1 rejected (pooled 37, 3000 steps)	-	acc_hist n_acc 0..4 = 596,720,491,366,827 (19.9% rejected at pos 1); target token = MTP rank 2: 285 (9.5% of steps), rank 3: 94, rank 4: 50, miss: 166	-	pooled 55.634, tok_step 3.0046, accept 0.5116 = serving (logging inert)	info	top-2 branch rescues 9.5% of steps; a rescued step gains ~2.5 tok with a 4-long branch (given pos1 ok, mean +1.54 more), ~1.7 with a 2-long branch => ceiling +0.24 tok/step (+8%) gross at verify batch 9 vs 5 plus 3 extra MTP steps; net likely 0-4% for 6-10 days and +0.75 GB VRAM. TREE deprioritized
VIMG	2026-09-30	r9700-qwen@ede2e0779 serving config	VRAM/GTT every 0.2 s: image at idle, then 182k-token prompt + image (results/d0/scripts/vram_img_peak.sh)	idle 31145 MiB, GTT 2585	peak VRAM 32614 of 32624; GTT 2585 -> 3036 at ~65% into the deep prefill, -> 4166 during the deep image encode	MiB	idle image 6.9 s ok; deep image 281.6 s (182322 prompt tokens) ok	info	VRAM climbs ~1.3 GB during a deep prefill (KV pages committed as written), so idle headroom overstates depth headroom: at >=~120k the card is full again and spills to GTT, and the deep image encode pushes ~1.6 GB more to GTT. Any lever that holds VRAM permanently (TREE +0.75 GB) is closed; next VRAM cut must be permanent
D10	2026-09-30	r9700-qwen@ede2e0779 serving config (results/d0/scripts/d10_run.sh, d10_inmodel.sh)	decode step budget ms, 16k / 70k / 176k (perf logger + step timing, load <2)	step wall 52.6 / 60.2 / 68.2 (tok/step 2.88/3.79/4.13)	verify GPU 43.2/45.1/54.8 (GEMV 38.0 vs floor 31.7 = 82-88% per op; lm_head 1.69 at floor; FA 0.4/2.2?/11.7 vs floor 9.95 at 183k; small ops 3.1-3.4); draft GPU 6.5/7.0/9.6 (4x n=1 1.41 ms, lm_head 98304 0.67 each); host ~3.2; residual 2.4/6-8/6	ms	measurement only	info	levers: GEMV to ~92% of 640 GB/s ~3 ms (FFN gate/up 17.4 vs 14.6, down 8.3 vs 7.3); draft-chain launch + sampling/accept residual 3-4 ms; small-op fusion ~1.5 ms + FA 176k ~1.7 ms. 70k FA (2.2 < 3.95 floor) and 70k host numbers suspect (phase 0 mixes prefill)
VP	2026-09-30	r9700-ar-vp@16440ac72 (LLAMA_RELEASE_COMPUTE_ON_IMAGE=1, LLAMA_DRAFT_UBATCH=128; default off)	peak VRAM / max GTT, 182k + image	32606 / 4457	32605 / 3979 (release); 32597 / 3979 (+ub128)	MiB	md5 not run (kill line failed)	discard	unaccounted 892 MiB = MTP draft ctx (KV 544 + compute 328), nothing hidden in Vulkan. The depth climb is prealloc_x: the RDNA4 prefill FA dequantizes the WHOLE q8_0 K+V (0..KV) to f16 per layer per ubatch (ggml-vulkan.cpp:9107), 4 KiB/token = 0.7 GiB at 176k, 1.1 GiB at 262k, reallocated as it grows ~every ubatch. Past ~120k VRAM/GTT oscillate ~500 MiB per ubatch. Lever -> FAC (chunked FA dequant)
